Symmetric_cryptography, Cryptography that makes use of shared secrets as opposed to public keys.
Symmetric_key, See also: <a href="#Shared_secret">Shared secret</a>.
Tag, The result of applying a keyed message authentication code to a message.
Tamper-proofing, See also: <a href="#Anti-tampering">Anti-tampering</a>.
Threat_model, A representation of the system threats that are expected to be reasonable. This includes denoting what kind of resources an attacker is expected to have, in addition to what kinds of things the attacker may be willing to try to do. Sometimes called an architectural security assessment.
Time_of_check.2C_time_of_use_problem, See also: <a href="#TOCTOU_problem">TOCTOU problem</a>.
TMAC, A two-keyed variant of the CBC-MAC that overcomes the fundamental limitation of that MAC.
TOCTOU_problem, Time-of-check, time-of-use race condition. A type of race condition between multiple processes on a file system. Generally what happens is that a single program checks some sort of property on a file, and then in subsequent instructions tries to use the resource if the check succeeded. The problem is that — even if the use comes immediately after the check — there is often some significant chance that a second process can invalidate the check in a malicious way. For example, a privileged program might check write privileges on a valid file, and the attacker can then replace that file with a symbolic link to the system password file.
Transport_Layer_Security_.28TLS.29, The successor to SSL, a protocol for establishing secure channels over a reliable transport, using a standard X.509 Public Key Infrastructure for authenticating machines. The protocol is standardized by the IETF.
Triple_DES, A variant of the original Data Encryption Standard that doubles the effective security. Often abbreviated to 3DES. The security level of 3DES is still considered to be very high, but there are faster block ciphers that provide comparable levels of security — such as AES.
Trojan, See also: <a href="#Backdoor">Backdoor</a>.
Trojan_Horse, See also: <a href="#Backdoor">Backdoor</a>.
Trusted_third_party, An entity in a system to whom entities must extend some implicit trust. For example, in a typical Public Key Infrastructure, the Certification Authority constitutes a trusted third party.
Twofish, A modern block cipher with 128-bit blocks and variable-sized keys.   A finalist in the AES competition; it is an evolution of the Blowfish cipher.
UMAC, A secure MAC based on a set of universal hash functions that is extremely fast in software but so complex that there has never been a validated implementation.
Universal_hash_function, A keyed hash function that has ideal hash properties. In practice, the only practical functions of this nature are really &quot;almost universal&quot; hash functions, meaning they come very close to being ideal. Universal and near-universal hash functions are not cryptographically secure when used naively for message authentication but can be adapted to be secure for this purpose easily.
Validation, The act of determining that data is sound. In security, generally used in the context of validating input.
VMAC, Variant of UMAC optimized for 64-bit architectures.
Weak_collision_resistance, A property that a hash function may have (and a good cryptographic hash function will have), characterized by it being unfeasible to find a second input that produces the same output as a known input.
Whitelist, When performing input validation, the set of items that, if matched, results in the input being accepted as valid. If there is no match to the whitelist, then the input is considered invalid. That is, a whitelist uses a &quot;default deny&quot; policy.
Window_of_vulnerability, The period of time in which a vulnerability can possibly be exploited.
What_are_web_applications.3F, A digital certificate that complies with the X.509 standard (produced by ANSI).
XCBC-MAC, A three-key variant of the CBC-MAC that overcomes the fundamental limitation of that MAC.
XMACC, A patented parallelizable Message Authentication Code.
XSS, See also: <a href="#Cross-site_scripting">Cross-site scripting</a>.
